sentence,entity1,entity2,offset1,offset2,relation
借助资本的力量腾飞江苏长电科技股份有限公司董事长王新潮访谈,王新潮,江苏长电科技股份有限公司,24,9,董事长
周五盘后发布公告称，中信银行已完成法定代表人变更的工商登记手续，，法定代表人由常振明先生变更为李庆萍女士。,李庆萍,中信银行,47,10,法定代表人
根据浦发银行公司业务部总经理杨斌介绍，，，%。,杨斌,浦发银行,14,2,无关系
东方航空总经理马须伦:加紧抢占上海自贸区和上海迪士尼商机,马须伦,东方航空,7,0,总经理
天茂集团今天披露，，刘益谦因身体原因，申请辞去公司董事、董事长法定代表人职务。,刘益谦,天茂集团,10,0,法定代表人
安徽省天然气开发股份有限公司总经理姚礼进先生,姚礼进,安徽省天然气开发股份有限公司,17,0,总经理
周敏峰为宁波华众法定代表人，同时亦是宁波华翔实际控制人周晓峰之兄，因此该项交易为关联交易。,周晓峰,宁波华翔,27,18,法定代表人
。仁和药业总经理张威在活动上向投资者表示，公司没有专门针对登革热的药物。,张威,仁和药业,8,1,总经理
民和股份董事总经理孙宪法在增持公司股票过程中，竟然出现了两次短线交易。,孙宪法,民和股份,9,0,总经理
"记者查阅公开资料发现,在华讯方舟对外投资的场合中,出面的多是董事长吕向阳。",向阳,华讯方舟,34,12,无关系
中恒集团股份有限公司董事长黄葆源谈发展思路,黄葆源,中恒集团,13,0,无关系
郭峰紫江企业集团股份有限公司副董事长、总经理,郭峰,紫江企业,0,2,总经理
",陆之敏、王福顺和陆之国冒充徐某海伦哲专法定代表人丁剑平的身份,通过微信聊天方式,以海伦哲公司需要项目资金为由,。",丁剑平,海伦哲,25,16,法定代表人
鞍钢股份:鞍钢集团总经理张晓刚就任ISO主席,张晓刚,鞍钢股份,12,0,无关系
资料显示，，陈兴汉为栖霞建设集团总裁、栖霞建设董事长兼总经理，江劲松是栖霞建设常务副总经理兼营销总监，干泳星为副总经理兼总会计师，徐水炎为公司董事、集团财务总监，范业铭为副总经理、总工程师，王建优为总经理助理兼董事会秘书，钟增贤为征地拆迁总监，余薇是总经济师。,范业铭,栖霞建设,81,10,总工程师
范力拟接任东吴证券董事长,范力,东吴证券,0,5,董事长
资料显示，重庆万盛是中外合资经营企业，，法定代表人是福耀玻璃董事长曹德旺的儿子曹代腾。,曹德旺,福耀玻璃,33,26,法定代表人
"方正电机董事长张敏同时表示,去年公司经营遇到的最大困难是市场低迷、劳动力成本持续上升。",张敏,方正电机,7,0,董事长
奥特迅表示，目前公司董事长兼总经理廖晓霞已在公司正常履职，公司生产经营状况正常。,廖晓霞,奥特迅,17,0,总经理
兖州煤业总经理尹明德辞任董事长李希勇代行职责,李希勇,兖州煤业,15,0,董事长
博云新材，，公司副总裁、总工程师张红波先生代表公司和长沙鑫航机轮刹车有限公司、霍尼韦尔中国有限公司在美国洛杉矶签署合资合同，三方共同出资组建霍尼韦尔博云航空系统湖南有限公司。,张红波,博云新材,16,0,总工程师
中国石油集团总会计师王国樑，中国石油股份公司副总裁沈殿成、总工程师蔺爱国，以及广东省及珠海市有关部门，中国石油集团总部机关有关部门的负责同志参加会谈和签字仪式。,蔺爱国,中国石油,33,0,总工程师
其中王晓秋负责自主品牌业务，沈阳依旧掌管上汽通用五菱，张海亮负责服务贸易板块，蓝青松接替肖国普并负责商用车业务。同时原上汽集团副总工程师程惊雷被任命为总工程师；钟立欣和陈伟峰则分别被任命为工会主席和纪委书记，职务均相当于副总裁级别。,程惊雷,上汽集团,68,59,总工程师
白银有色集团股份有限公司总经理雷思维先生致结束词,雷思维,白银有色,15,0,总经理
杰克缝纫机股份有限公司董事、董事会秘书、财务总监谢云娇女士,谢云娇,杰克缝纫机股份有限公司,24,0,财务总监
"银禧科技,公司总经理林登灿指出,。",林登灿,银禧科技,10,0,总经理
华能国际选举曹培玺为董事长,曹培玺,华能国际,6,0,董事长
。郴电国际财务总监许玉红表示，公司的城市供水价格有提价空间。,许玉红,郴电国际,9,1,财务总监
